start_time,end_time,text,emotion,sub-emotion,intensity
"00:27:10,000","00:27:11,000","Yes, he walks to and here, so that's ...",neutral,neutral,neutral
"00:27:11,000","00:27:12,000","Yes, he walks to and here, so that's ...",neutral,neutral,neutral
"00:27:13,000","00:27:22,000",Now everyone could clearly see how much that generalization was.,surprise,realization,mild
"00:27:22,000","00:27:30,000",He was 2 meters 30.,neutral,neutral,neutral
"00:27:30,000","00:27:31,000","Yes, everyone could see it.",neutral,neutral,neutral
"00:27:31,000","00:27:33,000","Yes, I liked that.",happiness,joy,mild
"00:27:33,000","00:27:40,000","Well, I have seen and heard it all here.",neutral,neutral,neutral
"00:27:40,000","00:27:44,000",We go to the hearing and then there will be a solution today.,happiness,optimism,moderate
"00:27:44,000","00:27:47,000","They sometimes say that if more women were in power,",happiness,curiosity,mild
"00:27:47,000","00:27:49,000",That there would be less of war.,happiness,optimism,mild
"00:27:49,000","00:27:53,000","Well, after today I start to doubt that very strongly.",sadness,disappointment,moderate
"00:27:53,000","00:27:56,000","Because oh, oh, what was it going for?",surprise,confusion,moderate
"00:27:56,000","00:28:00,000",It is obvious that these two neighbor women can no longer air or see each other.,disgust,disapproval,moderate
"00:28:00,000","00:28:03,000",And that is why I am very happy that Master Visser has been on the spot.,happiness,gratitude,mild
"00:28:03,000","00:28:07,000","He has looked at the parking situation very well, together with our surveyor.",happiness,approval,mild
"00:28:08,000","00:28:09,000",I put the mammoth in place.,neutral,neutral,neutral
"00:28:09,000","00:28:12,000",And I am actually very curious what Meester Visser thinks about it.,happiness,curiosity,moderate
"00:28:12,000","00:28:14,000","We're going to hear that now, because it's time for the hearing.",neutral,neutral,neutral
"00:28:14,000","00:28:17,000",Error 500 (Server Error)!!1500.That’s an error.There was an error. Please try again later.That’s all we know.,anger,annoyance,mild
"00:28:17,000","00:28:21,000","If it is unfinished, and you go outside the throat in the hearing,",surprise,confusion,moderate
"00:28:21,000","00:28:23,000",Then I turn around and then I look the other side.,disgust,disapproval,mild
"00:28:23,000","00:28:27,000","And I think people, I already know better, stop with that cross.",anger,annoyance,moderate
"00:28:27,000","00:28:31,000",My expectation from the neighbor is that she will lie everything to each other again.,disgust,disapproval,moderate
"00:28:31,000","00:28:34,000",And I hope that Master Frank Visser pricks through it.,,,
"00:28:34,000","00:28:37,000","Welcome, we are in this.",neutral,neutral,neutral
"00:28:37,000","00:28:44,000","In Sliedrecht, and the issue is the case between Teunie and Olga.",neutral,neutral,neutral
"00:28:44,000","00:28:48,000","Yes, what is it about?",happiness,curiosity,mild
"00:28:48,000","00:28:54,000","You madam, Teunie, you say the walls, we don't park properly.",disgust,disapproval,mild
"00:28:54,000","00:28:55,000",No. That's what it comes down to.,surprise,realization,mild
"00:28:55,000","00:28:58,000","Yes, they park outside the parking space.",disgust,disapproval,mild
"00:28:58,000","00:29:02,000",It is clearly described in the purchase or delivery acts ...,neutral,neutral,neutral
"00:29:02,000","00:29:05,000",that you have to stick to the regulations.,neutral,neutral,neutral
"00:29:05,000","00:29:10,000","And then it is clear, you have a parking space, a garage, a parking space and a terrace.",neutral,neutral,neutral
"00:29:10,000","00:29:12,000","Yes, you both have the same.",neutral,neutral,neutral
"00:29:12,000","00:29:13,000",And.,neutral,neutral,neutral
"00:29:13,000","00:29:15,000",Both are the owner of an apartment right.,neutral,neutral,neutral
"00:29:15,000","00:29:17,000","Now comes, what is that?",happiness,curiosity,mild
"00:29:17,000","00:29:22,000","Legal on the exclusively use of the house on the first and second floor, with a terrace.",neutral,neutral,neutral
"00:29:22,000","00:29:24,000",Error 500 (Server Error)!!1500.That’s an error.There was an error. Please try again later.That’s all we know.,anger,annoyance,mild
"00:29:24,000","00:29:28,000",Garage and parking space on the ground land.,neutral,neutral,neutral
"00:29:28,000","00:29:34,000","So that parking space is, yes, I would say, for you alone.",neutral,neutral,neutral
"00:29:34,000","00:29:35,000",That's right.,happiness,approval,mild
"00:29:35,000","00:29:36,000",That is stated in those actions. You bought that.,neutral,neutral,neutral
"00:29:36,000","00:29:37,000",That's right.,happiness,approval,mild
"00:29:37,000","00:29:40,000",But the camper that you put on it does not fit in.,disgust,disapproval,mild
"00:29:40,000","00:29:41,000",He is just a little too long.,neutral,neutral,neutral
"00:29:41,000","00:29:44,000","Now, just. Two meters thirty.",neutral,neutral,neutral
"00:29:44,000","00:29:44,000",Beats.,neutral,neutral,neutral
"00:29:44,000","00:29:47,000","I mean, an Italian gets two more cars in between.",happiness,amusement,mild
"00:29:47,000","00:29:48,000",Probably.,neutral,neutral,neutral
"00:29:48,000","00:29:49,000",And.,neutral,neutral,neutral
"00:29:49,000","00:29:50,000",Of course.,neutral,neutral,neutral
"00:29:50,000","00:29:52,000",And you have a problem with that.,disgust,disapproval,mild
"00:29:52,000","00:29:55,000","Yes, because she crosses way too far.",anger,annoyance,mild
"00:29:55,000","00:29:59,000",She has to stick to the regulations and not far outside your parking area.,disgust,disapproval,mild
"00:30:00,000","00:30:02,000",How often is that camper there?,happiness,curiosity,mild
"00:30:02,000","00:30:04,000",Two or three days before we leave.,neutral,neutral,neutral
"00:30:04,000","00:30:08,000",And as soon as we come back we clean it and immediately returns to the garage.,neutral,neutral,neutral
"00:30:08,000","00:30:13,000","And in the internal rules of the VvE, it is clearly described ...",neutral,neutral,neutral
"00:30:13,000","00:30:20,000","That campers, caravans and other trailers can be in their own parking space for ten days.",neutral,neutral,neutral
"00:30:20,000","00:30:23,000","Yes, I have internal rules here.",neutral,neutral,neutral
"00:30:23,000","00:30:25,000",That has been changed a number of times.,neutral,neutral,neutral
"00:30:25,000","00:30:26,000",That's right.,happiness,approval,mild
"00:30:26,000","00:30:27,000",When you were on the board.,neutral,neutral,neutral
"00:30:27,000","00:30:28,000",That's right.,neutral,neutral,neutral
"00:30:28,000","00:30:32,000","It may have nothing to do with it, but it has changed.",neutral,neutral,neutral
"00:30:32,000","00:30:34,000",A bit to your advantage.,happiness,approval,mild
"00:30:34,000","00:30:37,000","It has been changed to our advantage, that's right.",happiness,approval,mild
"00:30:37,000","00:30:38,000",I agree with you.,happiness,approval,mild
"00:30:38,000","00:30:42,000",But it can only change by majority votes.,neutral,neutral,neutral
"00:30:42,000","00:30:47,000","Mrs. Duijzer was not present at the meeting, so no vote cast.",neutral,neutral,neutral
"00:30:47,000","00:30:48,000",Error 500 (Server Error)!!1500.That’s an error.There was an error. Please try again later.That’s all we know.,anger,annoyance,mild
"00:30:48,000","00:30:49,000",And.,neutral,neutral,neutral
"00:30:49,000","00:30:50,000",Great.,happiness,approval,mild
"00:30:50,000","00:30:53,000","Then I now take a look at those internal regulations, as it has changed.",neutral,neutral,neutral
"00:30:53,000","00:30:59,000",The most important thing is that it is forbidden to park motor vehicles on the site.,neutral,neutral,neutral
"00:30:59,000","00:31:02,000",Unlike in the designated parking spaces.,neutral,neutral,neutral
"00:31:02,000","00:31:07,000","But for a short time elsewhere, if all parking bays are occupied.",neutral,neutral,neutral
"00:31:07,000","00:31:08,000",That's right.,neutral,neutral,neutral
"00:31:08,000","00:31:11,000",That is about double parking.,neutral,neutral,neutral
"00:31:11,000","00:31:16,000","When people have a lot of visitors, all parking spaces are often full.",neutral,neutral,neutral
"00:31:16,000","00:31:18,000",And then double parks.,neutral,neutral,neutral
"00:31:18,000","00:31:20,000",But that is not just because of us.,neutral,neutral,neutral
"00:31:20,000","00:31:22,000",It is also by other residents.,neutral,neutral,neutral
"00:31:22,000","00:31:25,000",Only we get the complaints.,anger,annoyance,mild
"00:31:25,000","00:31:27,000",Can I say something about that?,happiness,curiosity,mild
"00:31:27,000","00:31:28,000",And.,neutral,neutral,neutral
"00:31:28,000","00:31:33,000","When I come to drive the site and she walks outside, they always shoot in a direction.",surprise,confusion,mild
"00:31:33,000","00:31:35,000",And then they go your trip.,surprise,confusion,mild
"00:31:35,000","00:31:37,000",Is this going to light up the middle finger?,anger,anger,moderate
"00:31:37,000","00:31:40,000",Do you also want to tell that clearly that you have done that?,happiness,curiosity,mild
"00:31:40,000","00:31:42,000",I did that once.,neutral,neutral,neutral
"00:31:42,000","00:31:43,000",Twice.,neutral,neutral,neutral
"00:31:43,000","00:31:45,000","Anyway, how does things go?",happiness,curiosity,mild
"00:31:45,000","00:31:47,000","Well, you should listen.",neutral,neutral,neutral
"00:31:47,000","00:31:50,000",I actually just want to be free from my path.,happiness,desire,moderate
"00:31:50,000","00:31:51,000",Drive away.,happiness,desire,mild
"00:31:51,000","00:31:54,000",And otherwise no one have anything to do with anyone.,neutral,neutral,neutral
"00:31:54,000","00:31:56,000","Madam, you don't want anything to do with anyone.",neutral,neutral,neutral
"00:31:56,000","00:31:58,000",But you don't do it otherwise ...,surprise,confusion,mild
"00:31:58,000","00:31:59,000",The others are not doing well.,disgust,disapproval,mild
"00:31:59,000","00:32:00,000",The rules.,neutral,neutral,neutral
"00:32:00,000","00:32:01,000",You must ...,neutral,neutral,neutral
"00:32:01,000","00:32:03,000","Yes, isn't that?",surprise,confusion,mild
"00:32:03,000","00:32:06,000",We have been affected by the VVA.,anger,annoyance,mild
"00:32:06,000","00:32:07,000",Do you know why?,happiness,curiosity,mild
"00:32:07,000","00:32:08,000",Us.,neutral,neutral,neutral
"00:32:08,000","00:32:13,000",We were going to change excess stuff on Marktplaats.,neutral,neutral,neutral
"00:32:13,000","00:32:17,000","Well, we were not allowed to do that, because we caused nuisance.",anger,annoyance,mild
"00:32:17,000","00:32:20,000",So those have become lawsuits that I won.,happiness,pride,moderate
"00:32:20,000","00:32:21,000",I have it with me.,neutral,neutral,neutral
"00:32:21,000","00:32:23,000","I want to believe it, but what does it have with these things?",surprise,confusion,mild
"00:32:23,000","00:32:25,000","Well, the judge has shown.",neutral,neutral,neutral
"00:32:25,000","00:32:26,000",We gave no nuisance.,neutral,neutral,neutral
"00:32:26,000","00:32:29,000",But she does cause nuisance with that Kemper.,anger,annoyance,moderate
"00:32:29,000","00:32:31,000",To park double.,anger,annoyance,mild
"00:32:31,000","00:32:33,000",And the VVA doesn't do anything about that.,sadness,disappointment,moderate
"00:32:33,000","00:32:36,000",Is this about parking or about the entire VVA?,surprise,confusion,mild
"00:32:36,000","00:32:37,000",I would like that clear.,happiness,curiosity,mild
"00:32:37,000","00:32:41,000",Because I have nothing to do with those whole scenes.,neutral,neutral,neutral
"00:32:41,000","00:32:42,000",That's far before my time.,neutral,neutral,neutral
"00:32:42,000","00:32:44,000",I came to live there in 2014.,neutral,neutral,neutral
"00:32:44,000","00:32:47,000",We have received you with open arms in the first instance.,happiness,caring,mild
"00:32:47,000","00:32:50,000",Because we didn't want to know what the neighbors had to say about you.,neutral,neutral,neutral
"00:32:50,000","00:32:52,000",But you fell through the basket yourself.,disgust,disapproval,moderate
"00:32:52,000","00:32:55,000","And you are talking about the regulations, the internal regulations ...",anger,annoyance,mild
"00:32:55,000","00:32:58,000",What we all have to live so strictly after.,anger,annoyance,mild
"00:32:58,000","00:33:01,000",Every 14 days the green trays must be put outside ...,neutral,neutral,neutral
"00:33:01,000","00:33:02,000",of the general garden.,neutral,neutral,neutral
"00:33:02,000","00:33:05,000","And where is Mrs. Duijzer? No, I don't use that garden.",neutral,neutral,neutral
"00:33:05,000","00:33:07,000",But you will drive through with your car.,anger,annoyance,mild
"00:33:07,000","00:33:09,000",Error 500 (Server Error)!!1500.That’s an error.There was an error. Please try again later.That’s all we know.,surprise,confusion,mild
"00:33:09,000","00:33:11,000",Because you are in brother for that.,surprise,confusion,mild
"00:33:11,000","00:33:15,000","Well, maybe she can't do it. Come on, she can also walk?",anger,annoyance,mild
"00:33:15,000","00:33:17,000",But with lovely people about that green ...,neutral,neutral,neutral
"00:33:17,000","00:33:20,000","We have moved, Mr. Visser.",neutral,neutral,neutral
"00:33:20,000","00:33:23,000",Why? Because I was terribly in my back.,sadness,sadness,mild
"00:33:23,000","00:33:26,000",And the physiotherapist I came back every year.,neutral,neutral,neutral
"00:33:26,000","00:33:28,000","In short, you couldn't do it.",surprise,realization,mild
"00:33:28,000","00:33:29,000",Hey? You couldn't do it.,surprise,realization,mild
"00:33:29,000","00:33:32,000","No, plus moreover ... then we are out?",surprise,confusion,mild
"00:33:32,000","00:33:34,000",I couldn't ... plus it too.,sadness,sadness,mild
"00:33:34,000","00:33:38,000",My foot had operated on in 2021.,neutral,neutral,neutral
"00:33:38,000","00:33:39,000",You couldn't do it.,surprise,realization,mild
"00:33:39,000","00:33:43,000",In 2022 my other foot had.,neutral,neutral,neutral
"00:33:43,000","00:33:46,000",And now I break into my ... would you like to listen to me?,anger,annoyance,moderate
"00:33:46,000","00:33:47,000",And.,neutral,neutral,neutral
"00:33:47,000","00:33:49,000","I've said three times, you couldn't.",anger,annoyance,moderate
"00:33:49,000","00:33:51,000",No. But you're just going on.,anger,annoyance,moderate
"00:33:52,000","00:33:53,000",The same to tell.,anger,annoyance,mild
"00:33:53,000","00:33:58,000","Yes, but then it will be saved, because that says in the last notule.",neutral,neutral,neutral
"00:33:58,000","00:34:03,000",We as a board have not been able to change Mrs. Duijzer.,sadness,disappointment,mild
"00:34:03,000","00:34:07,000",I say it one more time. I believe you.,neutral,neutral,neutral
"00:34:07,000","00:34:08,000",And.,neutral,neutral,neutral
"00:34:10,000","00:34:12,000",And you photograph.,neutral,neutral,neutral
"00:34:12,000","00:34:17,000","I photograph the situations, the existing situations.",neutral,neutral,neutral
"00:34:17,000","00:34:20,000",Go look for a life. Stay out of our lives.,anger,anger,intense
"00:34:20,000","00:34:25,000","Stay away from home 15, including parking space.",anger,anger,intense
"00:34:25,000","00:34:27,000",Find a life.,anger,anger,intense
"00:34:27,000","00:34:29,000",Take a puzzle booklet and sit down.,anger,annoyance,moderate
"00:34:29,000","00:34:31,000",Then you see nothing about it.,neutral,neutral,neutral
"00:34:31,000","00:34:32,000",I do so often.,neutral,neutral,neutral
"00:34:32,000","00:34:35,000",I don't care about anything that happens in that parking lot.,neutral,neutral,neutral
"00:34:35,000","00:34:37,000",Let everyone go their own way.,neutral,neutral,neutral
"00:34:37,000","00:34:41,000","But no, Mrs. Duijzer has become a parking guard.",anger,annoyance,mild
"00:34:41,000","00:34:44,000",And photographer. And Treiteraar.,anger,annoyance,mild
"00:34:44,000","00:34:48,000",But leave us alone. I don't ask more.,anger,annoyance,moderate
"00:34:48,000","00:34:51,000",Good. Then I close the hearing.,neutral,neutral,neutral
"00:34:51,000","00:34:54,000",I'm going to think about this case.,neutral,neutral,neutral
"00:34:54,000","00:34:59,000",Because apart from the fact that it has become a huge state in the meantime ...,surprise,confusion,mild
"00:34:59,000","00:35:01,000",We also have to deal with rules.,neutral,neutral,neutral
"00:35:01,000","00:35:03,000",And I am also for that to apply it.,neutral,neutral,neutral
"00:35:03,000","00:35:07,000",Then I will come back to you and then I will tell you how it works legally.,neutral,neutral,neutral
"00:35:07,000","00:35:09,000",Thank you.,happiness,gratitude,mild
"00:35:16,000","00:35:18,000",I stand up for my rights.,happiness,pride,moderate
"00:35:18,000","00:35:22,000",I read my papers carefully and then I come up for my rights that I have.,happiness,pride,moderate
"00:35:24,000","00:35:26,000",She just has to stop that eternal whining.,anger,annoyance,moderate
"00:35:26,000","00:35:28,000",We really do not stand in the way of anyone.,neutral,neutral,neutral
"00:35:28,000","00:35:30,000",And it's just a whiningchaos.,anger,annoyance,moderate
"00:35:31,000","00:35:33,000","Well, Teunie. I would almost say ...",happiness,curiosity,mild
"00:35:33,000","00:35:36,000",Where do you get the energy from?,happiness,curiosity,mild
"00:35:36,000","00:35:40,000",I have the idea that it is actually no longer about parking cars ...,surprise,realization,mild
"00:35:40,000","00:35:45,000","Or for anything, but that there is a type of motivation to do this.",happiness,curiosity,mild
"00:35:45,000","00:35:48,000",That's not true. That is not true at all.,,,
"00:35:48,000","00:35:50,000","No, I know that.",neutral,neutral,neutral
"00:35:50,000","00:35:52,000",They do lawsuits to me because I give nuisance.,anger,annoyance,moderate
"00:35:52,000","00:35:55,000",We do not cause any inconvenience. They cause nuisance.,,,
"00:35:55,000","00:35:57,000",And that is why I thought it was unfair.,sadness,disappointment,moderate
"00:35:57,000","00:36:00,000",They do a three -year process.,anger,annoyance,moderate
"00:36:00,000","00:36:02,000",But the fact that you react that way is enough for me.,surprise,realization,mild
"00:36:02,000","00:36:04,000",She does cause nuisance.,anger,annoyance,moderate
"00:36:06,000","00:36:09,000","Well, do you have the confidence ...",happiness,curiosity,mild
"00:36:09,000","00:36:14,000",That the whining will stop if that statement has been?,happiness,curiosity,mild
"00:36:14,000","00:36:18,000",If a very high penalty comes up ...,fear,nervousness,moderate
"00:36:18,000","00:36:22,000",Then I really hope she will restrain.,,,
"00:36:22,000","00:36:25,000",A few more minutes and then it is out.,neutral,neutral,neutral
"00:36:28,000","00:36:32,000","Ladies and gentlemen, after a long, emotional day ...",neutral,neutral,neutral
"00:36:32,000","00:36:34,000",To which we have seen again ...,surprise,realization,mild
"00:36:34,000","00:36:37,000","That parking next to oxygen, water and food ...",happiness,amusement,mild
"00:36:37,000","00:36:40,000",Still really one of the first necessities ...,happiness,amusement,mild
"00:36:40,000","00:36:42,000",We finally arrived at the statement.,happiness,relief,mild
"00:36:42,000","00:36:44,000",And the big question is ...,happiness,curiosity,mild
"00:36:44,000","00:36:47,000",How is Master Visser going to reduce peace in the parking lot?,happiness,curiosity,moderate
"00:36:47,000","00:36:51,000",Can the camper and the double parked cars just remain standing?,happiness,curiosity,mild
"00:36:51,000","00:36:53,000",Or not?,happiness,curiosity,mild
"00:36:53,000","00:36:56,000","I want to ask you, as far as possible, of course, to stand all.",neutral,neutral,neutral
"00:36:56,000","00:36:59,000",Because our legal parking attendant is ready.,neutral,neutral,neutral
"00:36:59,000","00:37:01,000",Here is Master Frank Visser.,neutral,neutral,neutral
"00:37:01,000","00:37:06,000",APPLAUSE,happiness,approval,moderate
"00:37:06,000","00:37:08,000",You sit down.,neutral,neutral,neutral
"00:37:08,000","00:37:13,000",Ruling in Teunie's case against Olga.,neutral,neutral,neutral
"00:37:13,000","00:37:15,000",Rules are rules.,neutral,neutral,neutral
"00:37:15,000","00:37:18,000",And Teunie is right in that.,happiness,approval,mild
"00:37:18,000","00:37:21,000",But what are those rules then?,happiness,curiosity,mild
"00:37:21,000","00:37:24,000",According to the internal regulations ...,neutral,neutral,neutral
"00:37:24,000","00:37:28,000",May only be parked within the parking bays.,neutral,neutral,neutral
"00:37:28,000","00:37:32,000",And therefore not completely or partially outside.,neutral,neutral,neutral
"00:37:32,000","00:37:36,000","However, there are exceptions.",neutral,neutral,neutral
"00:37:36,000","00:37:39,000",Error 500 (Server Error)!!1500.That’s an error.There was an error. Please try again later.That’s all we know.,anger,annoyance,moderate
"00:37:39,000","00:37:45,000","Because if, in short, all general parking spaces are occupied ...",neutral,neutral,neutral
"00:37:45,000","00:37:49,000",Then you can do the car according to the internal regulations ...,neutral,neutral,neutral
"00:37:49,000","00:37:52,000",Parking outside the subjects for a short time.,neutral,neutral,neutral
"00:37:52,000","00:37:54,000",As happens now.,neutral,neutral,neutral
"00:37:54,000","00:37:56,000","Those are the rules, Mrs. Teunie.",neutral,neutral,neutral
"00:37:56,000","00:37:58,000",The same applies to the camper.,neutral,neutral,neutral
"00:37:58,000","00:38:03,000",It may not normally be placed outside the own parking space.,neutral,neutral,neutral
"00:38:03,000","00:38:07,000",But a reasonable explanation of the internal regulations ...,neutral,neutral,neutral
"00:38:07,000","00:38:10,000",Also justifies a short -term exception here ...,neutral,neutral,neutral
"00:38:10,000","00:38:13,000","To load, unload and clean.",neutral,neutral,neutral
"00:38:13,000","00:38:19,000","This resolved the legal issue of parking, I think.",happiness,relief,mild
"00:38:20,000","00:38:25,000",But what remains is the mutual treatment.,neutral,neutral,neutral
"00:38:25,000","00:38:30,000",Mrs. Teunie has bitten herself in an injustice ...,disgust,disapproval,moderate
"00:38:30,000","00:38:33,000",that she apparently was affected years ago.,sadness,sadness,mild
"00:38:33,000","00:38:38,000",But that is now in unpleasant and complaining behavior ...,anger,annoyance,moderate
"00:38:38,000","00:38:40,000",Against Olga and her family ...,disgust,disapproval,moderate
"00:38:40,000","00:38:44,000",who have not had anything to do with that earlier issue.,neutral,neutral,neutral
"00:38:44,000","00:38:47,000",Teunie has to stop.,disgust,disapproval,intense
"00:38:48,000","00:38:52,000",From now on she only has to interfere with her own affairs.,disgust,disapproval,intense
"00:38:52,000","00:38:55,000","That applies anyway, that is a good idea for everyone.",happiness,approval,mild
"00:38:55,000","00:39:00,000",I will therefore determine that the Teunie is prohibited with immediate effect ...,happiness,optimism,intense
"00:39:00,000","00:39:04,000",To contact Olga and her family ...,neutral,neutral,neutral
"00:39:04,000","00:39:07,000","In word and or gesture, or in any way ...",neutral,neutral,neutral
"00:39:07,000","00:39:10,000",or to complain about her ...,neutral,neutral,neutral
"00:39:10,000","00:39:14,000",Or in any other way to confront ...,neutral,neutral,neutral
"00:39:14,000","00:39:16,000",with the latter.,neutral,neutral,neutral
"00:39:16,000","00:39:19,000",And who does not comply with the statement ...,fear,fear,intense
"00:39:19,000","00:39:23,000",Force a fine to the counterparty of 100 euros per violation ...,neutral,neutral,neutral
"00:39:23,000","00:39:25,000","And it can go up to 10,000 euros.",neutral,neutral,neutral
"00:39:25,000","00:39:27,000",So don't do it.,fear,fear,intense
"00:39:27,000","00:39:30,000",It is rejected over and over again.,anger,annoyance,moderate
"00:39:30,000","00:39:34,000",This is my decision. The case has been finished. Thank you.,,,
"00:39:42,000","00:39:44,000","Olga, congratulations.",happiness,approval,mild
"00:39:44,000","00:39:47,000",I don't have to ask how happy you are.,happiness,joy,mild
"00:39:47,000","00:39:49,000",You don't have to ask me that.,happiness,joy,mild
"00:39:49,000","00:39:51,000",I am so happy.,happiness,joy,intense
"00:39:51,000","00:39:54,000","If all goes well, there is now peace. Are you looking forward to that?",happiness,optimism,mild
"00:39:54,000","00:39:56,000",Huge. Huge.,happiness,excitement,intense
"00:39:56,000","00:39:59,000",Am I going to this side?,neutral,neutral,neutral
"00:40:00,000","00:40:02,000",What do you think of the pronunciation?,happiness,curiosity,mild
"00:40:02,000","00:40:06,000","I do not agree, because it is not short -term parking.",disgust,disapproval,moderate
"00:40:06,000","00:40:11,000","No. Well, maybe that's a nice point for the next meeting of the VVE.",neutral,neutral,neutral
"00:40:11,000","00:40:15,000",What is short -term? That KERB has been parked continuously for days.,anger,annoyance,moderate
"00:40:15,000","00:40:18,000",You wanted the rules to be applied.,neutral,neutral,neutral
"00:40:18,000","00:40:21,000","Believe me, Master Visser did that. These are the rules.",happiness,approval,mild
"00:40:21,000","00:40:26,000","Yes, because the lady crashed every time on the board if she needed something again.",anger,annoyance,moderate
"00:40:26,000","00:40:29,000","If you give me the time to close, you can then continue talking.",neutral,neutral,neutral
"00:40:30,000","00:40:34,000",I want to thank you for coming and wish you a nice evening.,happiness,gratitude,mild
